{"audit_binding":{"audit_record_count":13,"audit_records_sha256":"ebc74aeebeab4ee860e6130388c5ed1edb91f8b9c2c291c63bc3eb162508d87f","run_id_sha256":"e90d13eeb0c001765b04e85afe4812275b5ede74fb959c4e46a6f1689d316cf7"},"captured_at_unix":1784240492,"cases":[{"case_id":"public_get","decision":"allow","outer_http_status":200,"rule_id":"unknown_safe_read","upstream_http_status":200},{"case_id":"public_head","decision":"allow","outer_http_status":200,"rule_id":"unknown_safe_read","upstream_http_status":200},{"case_id":"unknown_small_json","decision":"audit_only","outer_http_status":200,"rule_id":"unknown_json_post_audit","upstream_http_status":405},{"case_id":"unknown_multipart","decision":"deny","outer_http_status":403,"rule_id":"broker_multipart_denied","upstream_http_status":null},{"case_id":"unknown_octet_stream","decision":"deny","outer_http_status":403,"rule_id":"broker_octet_stream_denied","upstream_http_status":null},{"case_id":"unknown_put","decision":"deny","outer_http_status":403,"rule_id":"broker_method_denied","upstream_http_status":null},{"case_id":"cloud_metadata","decision":"deny","outer_http_status":403,"rule_id":"ssrf_non_public_ip","upstream_http_status":null}],"checks":{"audit_records_bound":true,"cloud_metadata_denied":true,"missing_identity_denied":true,"public_get_allowed":true,"public_head_allowed":true,"request_payloads_stored":false,"response_payloads_stored":false,"runtime_credentials_stored":false,"target_values_stored":false,"unknown_multipart_denied":true,"unknown_octet_stream_denied":true,"unknown_put_denied":true,"unknown_small_json_audit_only":true,"wrong_audience_denied":true},"decision":"GO","eligible_for_completion":false,"environment_binding":{"allowlist_contract_sha256":"5d2e4a8d94a42c36a3579624a1a7f59a67d427271e22ef36ecc4ade10e4a7351","allowlist_sha256":"5d904c9dea9848f1549c9e93bc76001e3ee4876166d662c90c731f269356c833","audit_contract_sha256":"f5e567852ce5e7ffabbe579c4aa566766e61c83d14f1e844183a5926dcb8a16d","broker_identity_contract_sha256":"589a76044bd3e24c1a7b962053461c54803b6aa284b4bb0b544e6bfe75c90bf2","broker_lifecycle_sha256":"153a1fa3cafa630291892cbacb5782ec665e0b2a06e1590e4d1575509f166bca","egress_decision_sha256":"f2a43b232c77f78af098c0c9914684d3896f700550e85760d0dfccf0bfccdecc","egress_guard_sha256":"11398aa61ee3db26c9f6f93a760f7000289338cd3407d9ee533bf0e17150f3af","evidence_schema_sha256":"14dfdb888f9d0c3264ebf3fde41fece50fbdd41c1c1993e91ab0036ac45d7212","mihomo_runtime_config_sha256":"dddc4927afa92d7af17fb01ff0a8c9bf2c3343b6f0197a0289f5ded7d752e5cb","proof_runner_sha256":"eb9a3c6787c380a9778af7c8981a92814015d3b9c881812837c3c35f567262f9","request_identity_required":true,"resolver_audit_rule":"mihomo_fake_ip_compat_resolved","resolver_mode":"mihomo_fake_ip_verified","runtime_source_bundle_sha256":"5380a0cac905294ca1cbc471eec6a7486d573e436f83e841d54c529dcf547f58","siq_fetch_sha256":"1ecee45adf0ab0acd2a853d07de37801c2f91e364b2bf0bfb5879a109b43e641","toolchain_manifest_sha256":"7ab40973a83d2724764c9d0efa721c4351e6b6bf00787286bbe63c6bcec21f04"},"formal_business_run":false,"formal_business_sandbox_evidence":false,"gateway":"siq-openshell-dev","not_claimed":["formal_business_sandbox","direct_transfer_client_execution","provider_route_availability","restart_persistence","semantic_dlp"],"passed":true,"readiness_effect":"none","schema_version":"siq.openshell.egress-boundary-proof.v1","scope":"host_egress_broker","valid_until_unix":1784244092}
